Szerver indítása...
🎉 King AI Backend (TypeScript) sikeresen elindult!
A szerver itt fut: http://localhost:3001
[Scheduler] Automata ütemező inicializálva.
[Scheduler] Már elmúlt dél, indítok egy soron kívüli foci szkennelést...
[AutoScanner] Szkennelés indítása: soccer...
ESPN: Kötegelt lekérés indul: 1 nap, 43 liga...
ESPN: Összesen 43 kérés indítása 5-ös kötegekben...
ESPN: Köteg futtatása (1-5 / 43)...
ESPN: Köteg futtatása (6-10 / 43)...
ESPN: Köteg futtatása (11-15 / 43)...
ESPN: Köteg futtatása (16-20 / 43)...
ESPN: Köteg futtatása (21-25 / 43)...
ESPN: Köteg futtatása (26-30 / 43)...
ESPN: Köteg futtatása (31-35 / 43)...
ESPN: Köteg futtatása (36-40 / 43)...
ESPN: Köteg futtatása (41-43 / 43)...
ESPN: 18 egyedi meccs lekérve (kötegelve) a következő 1 napra.
[AutoScanner] 18 meccs találva a(z) soccer sportágban.
[AutoScanner] Vizsgálat: AEK Athens vs CSU Craiova...
[Gemini] Google Search Grounding AKTIVÁLVA.
Gemini API hívás indul (gemini-2.0-flash-exp)... (Search: true)
[Gemini JSON Clean] + jelek eltávolítva a pozitív számok elől.
[AI_Service v147.0 - Data Hunter] SIKER: Adatok megtalálva a(z) AEK Athens vs CSU Craiova meccshez.
Nincs cache (vagy kényszerítve) (rich_context_v117.0_soccer_AEK%20Athens_CSU%20Craiova), friss adatok lekérése...
[DataFetch v125.0] ✅ Manuális xG megadva → Deep Scout xG keresés kihagyva (optimalizáció)
Gemini API hívás indul (gemini-1.5-pro)... (Search: false)
API Adatgyűjtés indul (Provider: api-sports-soccer)...
[apiSportsProvider v107.1] STATIKUS LIGA TALÁLAT! A rendszer ismeri ezt a ligát ("world_uefaconferenceleague" -> ID: 848). API keresés kikerülve.
API-SPORTS Név Keresés (soccer): "AEK Athens" (Nincs térkép bejegyzés, közvetlen keresés)
API-SPORTS (soccer): Csapatlista kísérlet a(z) 2025 szezonra (Liga: 848)...
API-SPORTS (soccer): Csapatlista lekérése (Liga: 848, Szezon: 2025)...
API-SPORTS (soccer): Csapatlista kísérlet a(z) 2024 szezonra (Liga: 848)...
API-SPORTS (soccer): Csapatlista lekérése (Liga: 848, Szezon: 2024)...
API KULCS ROTÁLÁS: Váltás a(z) 2. kulcsra (soccer)...
API-SPORTS (soccer): Csapatlista kísérlet a(z) 2023 szezonra (Liga: 848)...
API-SPORTS (soccer): Csapatlista lekérése (Liga: 848, Szezon: 2023)...
API-SPORTS Név Keresés (soccer): "CSU Craiova" (Nincs térkép bejegyzés, közvetlen keresés)
API-SPORTS (soccer): Csapatlista kísérlet a(z) 2025 szezonra (Liga: 848)...
API-SPORTS (soccer): Csapatlista lekérése (Liga: 848, Szezon: 2025)...
API-SPORTS (soccer): Csapatlista kísérlet a(z) 2024 szezonra (Liga: 848)...
API-SPORTS (soccer): Csapatlista lekérése (Liga: 848, Szezon: 2024)...
API-SPORTS (soccer): Csapatlista kísérlet a(z) 2023 szezonra (Liga: 848)...
API-SPORTS (soccer): Csapatlista lekérése (Liga: 848, Szezon: 2023)...
API-SPORTS (soccer): Csapatlista lekérése (Liga: 848, Szezon: 2025)...
Gemini API hívás indul (gemini-1.5-pro)... (Search: false)
Gemini API hívás indul (gemini-1.5-pro)... (Search: false)
Adatgyűjtés indul (v95.3 - soccer): AEK Athens vs CSU Craiova...
[apiSportsProvider] Feloldott ID-k fogadva: H:null, A:null, L:848, S:2025
API-SPORTS (soccer): Adatok párhuzamos lekérése... (FixtureID: null)
[API-SPORTS LineupData] Lekérés kihagyva (Sport nem foci, vagy hiányzó FixtureID/Team ID).
API-SPORTS (soccer): Párhuzamos lekérések befejezve.
Végleges stats használatban: Home(GP:1), Away(GP:1)
[apiSportsProvider v125.0] ✅ Manuális xG értékek beépítve: H_xG=1.83, H_xGA=0.94, A_xG=1.68, A_xGA=1
[apiSportsProvider v144.0] ✅ Manuális PPG értékek beépítve: H_PPG=2.43, A_PPG=1.85
[DataFetch v125.0] xG forrás ellenőrzés: manual_H_xG=1.83, manual_H_xGA=0.94, manual_A_xG=1.68, manual_A_xGA=1
[DataFetch v125.0] ✅ MANUÁLIS xG HASZNÁLVA: H_xG=1.83, H_xGA=0.94, A_xG=1.68, A_xGA=1
[DataFetch v144.0] ✅ MANUÁLIS PPG HASZNÁLVA: H_PPG=2.43, A_PPG=1.85
[AiOddsProvider] Odds keresése a weben (Google Search)... AEK Athens vs CSU Craiova
[Gemini] Google Search Grounding AKTIVÁLVA.
Gemini API hívás indul (gemini-2.0-flash-exp)... (Search: true)
[Gemini JSON Clean] + jelek eltávolítva a pozitív számok elől.
[AiOddsProvider] SIKER! Forrás: Oddspedia. H:1.44, D:3.7, A:7.2
Sikeres adat-egyesítés (v117.0 Market Spy), cache mentve (rich_context_v117.0_soccer_AEK%20Athens_CSU%20Craiova).
[SoccerStrategy v134.0] Liga: "UEFA Conference League", Defensive Multiplier: 0.94
[SoccerStrategy v130.0] 🛡️ DEFENSIVE MULTIPLIER APPLIED (0.94x):
  Before: H_xG=1.83, A_xG=1.68 (Total: 3.51)
  After:  H_xG=1.72, A_xG=1.58 (Total: 3.30)
[SoccerStrategy v147.0] ✅ VICTORY PROTOCOL P1: mu_h=1.41, mu_a=1.30 (Weight: 1.5x)
[Model.ts - 1. Ügynök] Tiszta xG (soccer): H=1.41, A=1.30 (Forrás: Manual (Victory Protocol 1.5x xG Weight) [v147.0])
[utils.ts/findMainTotalsLine] Valódi fővonal azonosítva: 2.5
[Model.ts/calculateValue] 1 db értékes fogadás azonosítva.
[AutoScanner] 🔥 TALÁLAT: AEK Athens vs CSU Craiova - Teljes elemzés indítása...
Nincs cache (analysis_v112.0_apex_soccer_aekathens_vs_csucraiova), friss elemzés indul...
[Lánc 0/6] Stratégia Gyár: Elemzési stratégia kiválasztása a 'soccer' sportághoz...
[Lánc 2/6] Scout Ügynök: Kontextus és Piac lekérése (AI-First)...
Cache találat (rich_context_v117.0_soccer_AEK%20Athens_CSU%20Craiova)
Adatgyűjtés kész: AEK Athens vs CSU Craiova.
[utils.ts/findMainTotalsLine] Valódi fővonal azonosítva: 2.5
Meghatározott fő gól/pont vonal: 2.5
Piaci Hírszerzés: Nincs elérhető nyitó piaci adat.
[Lánc 2.5/6] Pszichológus Ügynök: Narratív profilalkotás...
Gemini API hívás indul (gemini-1.5-pro)... (Search: false)
[Lánc 2.5/6] Pszichológus végzett.
[Lánc 2.6/6] Önjavító Hurok: 7. Ügynök (Revizor) múltbeli tanulságainak beolvasása...
[Lánc 2.6/6] Nincsenek múltbeli tanulságok a Narratív Cache-ben ehhez a párosításhoz.
[Lánc 1/6] Quant Ügynök: Tiszta xG számítása...
[SoccerStrategy v134.0] Liga: "UEFA Conference League", Defensive Multiplier: 0.94
[SoccerStrategy v130.0] 🛡️ DEFENSIVE MULTIPLIER APPLIED (0.94x):
  Before: H_xG=1.83, A_xG=1.68 (Total: 3.51)
  After:  H_xG=1.72, A_xG=1.58 (Total: 3.30)
[SoccerStrategy v147.0] ✅ VICTORY PROTOCOL P1: mu_h=1.41, mu_a=1.30 (Weight: 1.5x)
[Model.ts - 1. Ügynök] Tiszta xG (soccer): H=1.41, A=1.30 (Forrás: Manual (Victory Protocol 1.5x xG Weight) [v147.0])
Quant (Tiszta xG) [Manual (Victory Protocol 1.5x xG Weight) [v147.0]]: H=1.41, A=1.30
[Lánc 3/6] Specialista Ügynök (AI): Kontextuális módosítók alkalmazása...
Gemini API hívás indul (gemini-1.5-pro)... (Search: false)
Specialista (AI) (Súlyozott xG - Végleges): H=1.41, A=1.30
[Model.ts] Haladó metrikák (soccer): Szöglet=10.10, Lap=4.20
[Confidence] xG Diff: 0.11 (4.0%) | Thresholds: High=5.0%, Low=1.2%
[Confidence] Totals Diff: 0.21 (8.4%) | Thresholds: High=8.0%, Low=2.5%
Szimulátor (Bizalom): Győztes=6.5, Pontok=9.5, Átlag=7.7
[AnalysisFlow v139.2] Dinamikus szimuláció: 37500 (confidence: 7.7/10, multiplier: 1.50x)
[Model.ts/calculateValue] 1 db értékes fogadás azonosítva.
Szimulátor végzett.
[Lánc 5/6] "Hibrid Főnök" hívása (Apex Logic)...
Gemini API hívás indul (gemini-1.5-pro)... (Search: false)
Gemini API hívás indul (gemini-1.5-pro)... (Search: false)
Gemini API hívás indul (gemini-1.5-pro)... (Search: false)
Gemini API hívás indul (gemini-1.5-pro)... (Search: false)
Gemini API hívás indul (gemini-1.5-pro)... (Search: false)
Gemini API hívás indul (gemini-1.5-pro)... (Search: false)
Gemini API hívás indul (gemini-1.5-pro)... (Search: false)
Gemini API hívás indul (gemini-1.5-pro)... (Search: false)
Gemini API hívás indul (gemini-1.5-pro)... (Search: false)
Gemini API hívás indul (gemini-1.5-pro)... (Search: false)
Gemini API hívás indul (gemini-1.5-pro)... (Search: false)
Gemini API hívás indul (gemini-1.5-pro)... (Search: false)
Bizottsági Lánc Befejezve. Ajánlás: {"recommended_bet":"Hiba","final_confidence":1,"brief_reasoning":"KRITIKUS HIBA: AI Hiba (Főnök): Gemini API hiba: Státusz 404. A többi elemzés (ha van) még érvényes lehet."} (Végső bizalom: 1)
Elemzés befejezve és cache mentve (analysis_v112.0_apex_soccer_aekathens_vs_csucraiova)
[AutoScanner] Vizsgálat: AEK Larnaca vs KF Shkëndija...
Elemzés (JSON) mentve a Google Sheet-be (analysis_v112.0_apex_soccer_aekathens_vs_csucraiova)
[Gemini] Google Search Grounding AKTIVÁLVA.
Gemini API hívás indul (gemini-2.0-flash-exp)... (Search: true)
